{
  "schema_version": 1,
  "color": {
    "bg": {
      "bgBase": "#0F172A",
      "bgSurface": "#131b2d",
      "bgElevated": "#1E293B"
    },
    "border": {
      "borderMuted": "#334155",
      "borderStrong": "#2a3342"
    },
    "text": {
      "textPrimary": "#d7dde7",
      "textSecondary": "#98a4b8",
      "placeholder": "#7f8ba0"
    },
    "accent": {
      "accentP1": "#2f6ed8",
      "accentP2": "#cf3f3f",
      "accentPrimaryAction": "#b88a26",
      "accentDanger": "#a35345",
      "accentGhost": "#6f7d92"
    },
    "game": {
      "player": "#2f6ed8",
      "model": "#cf3f3f",
      "objective": "#b88a26",
      "selection": "#d7b66f"
    }
  },
  "radius": {
    "sm": 8,
    "md": 12,
    "groupBox": 6,
    "button": 4
  },
  "spacing": {
    "xs": 6,
    "sm": 8,
    "md": 12,
    "lg": 16,
    "xl": 20
  },
  "font": {
    "ui": {
      "family": "Rajdhani",
      "sizePx": 14
    },
    "data": {
      "family": "IBM Plex Mono",
      "sizePx": 12
    },
    "viewerBody": {
      "family": "Segoe UI",
      "sizePx": 11
    }
  },
  "motion": {
    "moveEase": "smoothstep",
    "moveEaseFxV2": "cubic_out",
    "fxV2": {
      "low": { "moveCapScale": 0.82, "popupTtlScale": 0.72, "hitStopMs": 0, "gaussAlphaScale": 0.55 },
      "medium": { "moveCapScale": 1.0, "popupTtlScale": 1.0, "hitStopMs": 32, "gaussAlphaScale": 1.0 },
      "high": { "moveCapScale": 1.08, "popupTtlScale": 1.18, "hitStopMs": 48, "gaussAlphaScale": 1.12 }
    }
  }
}
